<?xml version="1.0" encoding="UTF-8" ?>

<?xml-stylesheet href="boutique.css" type="text/css"?> 





<boutique xmlns:xsd="http://www.w3.org/2001/XMLSchema-instance" xsd:noNamespaceSchemaLocation="boutique.xsd">

	<telephone>
	<marque>Samsung</marque>
	<modele>s10</modele>	
	</telephone>
	
	<telephone>
	<marque>Sony</marque>
	<modele>g5600</modele>	
	</telephone>
	
	<telephone>
	<marque>Nokia</marque>
	<modele>3310</modele>	
	</telephone>


</boutique>